{
  "source_name": "cnbeta",
  "source_url": "https://www.cnbeta.com.tw/backend.php",
  "total_items": 10,
  "items": [
    {
      "title": "马斯克又画“饼”：在月球上建造AI卫星工厂",
      "link": "https://www.cnbeta.com.tw/articles/tech/1549532.htm",
      "pubDate": "Wed, 11 Feb 2026 12:30:05 GMT",
      "description": "<p>随着马斯克将太空业务的重心转向月球，世界首富又给全球股民画了个新“饼”：<strong>在月球上建设一座人工智能卫星工厂，并配置一座巨型弹射器将卫星发射升空。</strong>据悉，当地时间周二晚间，马斯克在人工智能公司xAI的员工大会上发表上述愿景。</p> <a href=\"https://www.cnbeta.com.tw/articles/tech/1549532.htm\" target=\"_blank\"><strong>阅读全文</strong></a>",
      "guid": "https://www.cnbeta.com.tw/articles/tech/1549532.htm"
    },
    {
      "title": "地球宜居之谜：科学家发现“水之外”的关键条件",
      "link": "https://www.cnbeta.com.tw/articles/science/1549530.htm",
      "pubDate": "Wed, 11 Feb 2026 12:25:24 GMT",
      "description": "<p><span style=\"text-wrap-mode: wrap;\">地球之所以成为孕育生命的行星，可能源于其在诞生之初恰到好处地达成了一种微妙的化学平衡，使关键的生命元素既没有被封存在行星核心深处，也没有逃逸到太空中。一项由瑞士苏黎世联邦理工学院（ETH Zurich）研究团队主导的最新研究指出，单有液态水远远不够，行星在形成金属内核的早期阶段，必须满足极为狭窄的含氧条件，才能同时保留对生命至关重要的磷和氮。</span></p> <a href=\"https://www.cnbeta.com.tw/articles/science/1549530.htm\" target=\"_blank\"><strong>阅读全文</strong></a>",
      "guid": "https://www.cnbeta.com.tw/articles/science/1549530.htm"
    },
    {
      "title": "微软修复记事本高危漏洞 黑客可借恶意Markdown文件远程控制电脑 ($100漏洞赏金)",
      "link": "https://www.cnbeta.com.tw/articles/tech/1549528.htm",
      "pubDate": "Wed, 11 Feb 2026 12:21:17 GMT",
      "description": "<p><span style=\"text-wrap-mode: wrap;\">微软近日发布安全更新，修复了 Windows 记事本中的一项严重安全漏洞，该漏洞一旦被成功利用，可能使黑客远程执行恶意代码，从而完全接管受害者的电脑。 这一问题与此前在 Notepad++ 中发现的安全事件不同，专门影响通过 Microsoft Store 提供的现代版 Windows 记事本应用，尤其是在处理 Markdown（.md）文件时的行为。</span></p> <a href=\"https://www.cnbeta.com.tw/articles/tech/1549528.htm\" target=\"_blank\"><strong>阅读全文</strong></a>",
      "guid": "https://www.cnbeta.com.tw/articles/tech/1549528.htm"
    },
    {
      "title": "iPhone 18 Pro 预计搭载 C2 基带 将引入 5G 卫星连接能力",
      "link": "https://www.cnbeta.com.tw/articles/tech/1549526.htm",
      "pubDate": "Wed, 11 Feb 2026 12:19:27 GMT",
      "description": "<p><span style=\"text-wrap-mode: wrap;\">苹果下一代自研 C2 基带调制解调器将于今年首发于 iPhone 18 Pro 系列，并支持 5G 卫星连接功能。 该爆料来自微博账号“定焦数码”，其表示，苹果这款 C2 基带将支持 NR-NTN（New Radio Non-Terrestrial Networks，新空口非地面网络）标准。 这一标准既可以指手机直连卫星，也可以指通过卫星为运营商提供回传链路，从而将网络覆盖扩展到偏远地区。&nbsp;</span></p> <a href=\"https://www.cnbeta.com.tw/articles/tech/1549526.htm\" target=\"_blank\"><strong>阅读全文</strong></a>",
      "guid": "https://www.cnbeta.com.tw/articles/tech/1549526.htm"
    },
    {
      "title": "拳头开发了10年的游戏 结果1个月不到就宣布裁员 (CEO称\"重组\"是必要的)",
      "link": "https://www.cnbeta.com.tw/articles/game/1549524.htm",
      "pubDate": "Wed, 11 Feb 2026 12:14:31 GMT",
      "description": "<p>早在 2019 年，Riot 公布了一款代号为 Project L 的格斗游戏，后来正式定名为《2XKO》。该作于 2025 年末在 PC 平台开启抢先体验，并在 2026 年 1 月登陆主机平台。据外媒报道，虽然游戏是在 2019 年对外公布，但其开发周期实际上要早得多。</p> <a href=\"https://www.cnbeta.com.tw/articles/game/1549524.htm\" target=\"_blank\"><strong>阅读全文</strong></a>",
      "guid": "https://www.cnbeta.com.tw/articles/game/1549524.htm"
    },
    {
      "title": "官宣！长征十号甲火箭一子级成功完成海上可控溅落回收",
      "link": "https://www.cnbeta.com.tw/articles/science/1549522.htm",
      "pubDate": "Wed, 11 Feb 2026 12:14:17 GMT",
      "description": "<p>2月11日，长征十号甲液体运载火箭在文昌航天发射场成功完成系统低空演示验证与梦舟载人飞船系统最大动压逃逸飞行试验。<strong>火箭一级箭体和飞船返回舱分别按程序受控安全溅落于预定海域。</strong></p> <a href=\"https://www.cnbeta.com.tw/articles/science/1549522.htm\" target=\"_blank\"><strong>阅读全文</strong></a>",
      "guid": "https://www.cnbeta.com.tw/articles/science/1549522.htm"
    },
    {
      "title": "力积电黄崇仁：存储缺货到2028年都不一定缓解",
      "link": "https://www.cnbeta.com.tw/articles/tech/1549520.htm",
      "pubDate": "Wed, 11 Feb 2026 12:14:08 GMT",
      "description": "<p>力积电董事长黄崇仁近日在接受采访时，面对近几个月的这波存储缺货涨价潮，连他这位业界资历超过30年老人都感叹第一次见到这种现象。<strong>他表示：“这是我做存储器30年来，第一次看到这种现象。这是我第一次看不到缺口什么时候可以解决。”</strong></p> <a href=\"https://www.cnbeta.com.tw/articles/tech/1549520.htm\" target=\"_blank\"><strong>阅读全文</strong></a>",
      "guid": "https://www.cnbeta.com.tw/articles/tech/1549520.htm"
    },
    {
      "title": "华裔研究生研发出AI相亲软件 让斯坦福超5000名学生沉迷 (使用`机器学习`技术)",
      "link": "https://www.cnbeta.com.tw/articles/tech/1549518.htm",
      "pubDate": "Wed, 11 Feb 2026 12:12:28 GMT",
      "description": "<p><strong style=\"text-wrap-mode: wrap;\">美国斯坦福大学正被一股无形的“技术引力”牵引——每周二晚九点，超过5000名本科生准时打开一款名为Date Drop的AI相亲软件，等待算法“发配”配对对象。</strong><span style=\"text-wrap-mode: wrap;\">Date Drop由斯坦福华裔研究生亨利·翁在约三周内编写完成。</span><strong style=\"text-wrap-mode: wrap;\">用户需回答66道涉及价值观、生活方式与政治立场的选择题，系统据此匹配合适对象。</strong></p> <a href=\"https://www.cnbeta.com.tw/articles/tech/1549518.htm\" target=\"_blank\"><strong>阅读全文</strong></a>",
      "guid": "https://www.cnbeta.com.tw/articles/tech/1549518.htm"
    },
    {
      "title": "Google确认Android 17首个测试版即将推送",
      "link": "https://www.cnbeta.com.tw/articles/tech/1549516.htm",
      "pubDate": "Wed, 11 Feb 2026 12:11:51 GMT",
      "description": "<p>Google近期向符合条件的 Pixel 设备推送了 Android 16 QPR3 Beta 2.1 更新的同时，也确认首个 Android 17 测试版（Android 17 Beta 1）即将到来。 Google在 Reddit 发帖透露，Android 17 Beta 1 很快会面向用户推送，将带来一系列错误修复以及性能与系统稳定性的提升。</p> <a href=\"https://www.cnbeta.com.tw/articles/tech/1549516.htm\" target=\"_blank\"><strong>阅读全文</strong></a>",
      "guid": "https://www.cnbeta.com.tw/articles/tech/1549516.htm"
    },
    {
      "title": "福特CEO：中国车企改变了全球的\"游戏规则\"",
      "link": "https://www.cnbeta.com.tw/articles/tech/1549514.htm",
      "pubDate": "Wed, 11 Feb 2026 10:34:23 GMT",
      "description": "<p><strong>福特汽车CEO吉姆・法利在财报电话会议中表示，中国汽车制造商改变了全球的“游戏规则”，并对传统汽车制造商构成威胁。</strong>法利强调，福特汽车面临的真正问题，是中国车企主导了电气化转型，并改变了汽车的定价权。</p> <a href=\"https://www.cnbeta.com.tw/articles/tech/1549514.htm\" target=\"_blank\"><strong>阅读全文</strong></a>",
      "guid": "https://www.cnbeta.com.tw/articles/tech/1549514.htm"
    }
  ]
}
